{"caseContext":{"attempt":{"attemptId":"s09.normalize.s09.normalize.rejection.004.r3","idempotencyKey":"15f7e259091bd61e3b59403d06be7d97fc95f7ef14e3179ff225b2009f9710ee","repetition":3},"candidateRef":{"byteLength":2467,"contentHash":"3e473dff9434d25d7d97bb577543ca18d6e771988d6b4184c776a179fa16885c","fileSha256":"301237afdc9589a6862427e40977f96ea954009c3ffb3a0fd00e47b12d86cd82","id":"REG-NORM-SHARP-CANONICAL-PNG@0.9.0","path":"candidate-locks/composite-canonical-png.v0.9.0.json"},"contentHash":"cd5257c12aa449bb43570e899daaa3cd0fe96a825e1cb5f03ae820c1c19fdf1c","contextId":"context.s09.normalize.s09.normalize.rejection.004.r3","contractRef":{"byteLength":890,"contentHash":"9788a9cb9c9c539f502a2f01695be3f74d0a70868b44f6807561a8eb39d3fee5","fileSha256":"895c51fde2224f69c8e999b68382090e12c023cc6f75dfa1950f33c48c2bee86","id":"CC-CAP02-NORMALIZE-PNG@0.9.0","path":"contracts/cc-cap02-normalize-png.v0.9.0.json"},"disposition":"rejection","expectedStableErrorCode":"S09_INPUT_CRC_MISMATCH","goldIdentityRef":null,"manifestRef":{"byteLength":4067,"contentHash":"e7fdb36c9841e21c97cd61e64219d82cf957eec1d091fbfce9fb501ab58d2ac4","fileSha256":"49ae18873a63a09c6683b913292df3177c9ca96cfef4727172df7c6cf07c0630","id":"FM-GATEB-NORMALIZE-PNG@0.9.0","path":"manifests/normalize-smoke.v0.9.0.json"},"operation":"normalize","runtimeRef":{"byteLength":29240,"contentHash":"be963d57e22744f760ec54cac7b83904ebe3878c4ec8e25b958aa1015ad8a3e5","fileSha256":"4ee8d8a1bf356412a4ca5bbd9e42f242d94c997b45f348dfc50314ddb697d446","id":"RUNTIME-SHARP-CANONICAL-PNG@0.9.0","path":"runtime/runtime-attestation.v0.9.0.json"},"schemaVersion":"gateb-case-context.slice09.v0","sourceId":"s09.normalize.rejection.004","sourceRef":{"byteLength":1214,"contentHash":"aa6616d8691670351d5b501c4b31e7d6791dbfa35c46f644745c4e9e04d9cf88","fileSha256":"9b6dac2ba70f49db63de15d832b4210e75e2a6e7dbc0ae813590062deb2c21d7","id":"s09.normalize.rejection.004","path":"source-lineage/normalize/s09.normalize.rejection.004.json"},"workerRef":{"id":"WORKER-SHARP-RAW@0.9.0","implementationSha256":"4ce6b725d509e35328c6826f1a7345c34b2582d2df19a9cb4b6115b8990f30bd"},"workerRequestRef":{"byteLength":1214,"contentHash":"aa6616d8691670351d5b501c4b31e7d6791dbfa35c46f644745c4e9e04d9cf88","fileSha256":"9b6dac2ba70f49db63de15d832b4210e75e2a6e7dbc0ae813590062deb2c21d7","id":"s09.normalize.rejection.004","path":"source-lineage/normalize/s09.normalize.rejection.004.json"}},"contentHash":"6598a71c5ee1aa2165bc74d8c63f0065dc2229abf08aca411a0dbadc107d8d21","evidenceBoundary":{"C1":0,"E1":0,"G1":0,"O1":0,"R1":0,"U1":0,"V1":0,"formal":false,"productSupport":false,"releaseAllowlist":"none","releaseApproved":0,"releaseRegistered":0},"requestId":"request.s09.normalize.s09.normalize.rejection.004.r3","schemaVersion":"local-run-request.slice09.v0"}
