{"caseContext":{"attempt":{"attemptId":"s09.normalize.s09.normalize.applicable.001.r1","idempotencyKey":"8cd5138567eb47bec865e3845fe02b9c38230423841b38b8d33726ca4dca4212","repetition":1},"candidateRef":{"byteLength":2467,"contentHash":"3e473dff9434d25d7d97bb577543ca18d6e771988d6b4184c776a179fa16885c","fileSha256":"301237afdc9589a6862427e40977f96ea954009c3ffb3a0fd00e47b12d86cd82","id":"REG-NORM-SHARP-CANONICAL-PNG@0.9.0","path":"candidate-locks/composite-canonical-png.v0.9.0.json"},"contentHash":"c18a887c7197d79e064fc764b5c8a809756afbf74ae57ce0ba0a6f74d2215cc4","contextId":"context.s09.normalize.s09.normalize.applicable.001.r1","contractRef":{"byteLength":890,"contentHash":"9788a9cb9c9c539f502a2f01695be3f74d0a70868b44f6807561a8eb39d3fee5","fileSha256":"895c51fde2224f69c8e999b68382090e12c023cc6f75dfa1950f33c48c2bee86","id":"CC-CAP02-NORMALIZE-PNG@0.9.0","path":"contracts/cc-cap02-normalize-png.v0.9.0.json"},"disposition":"applicable","expectedStableErrorCode":null,"goldIdentityRef":{"byteLength":1708,"contentHash":"bafd0316be055b049ed9868e5861df64f02329648436ebc3a637f7ab5ae20d1c","fileSha256":"c9d793deae261a24bf9133294b6a1445709784bc58406ea8448c2e9bfd7d1cbe","id":"gold-identity.s09.normalize.applicable.001","path":"gold-identities/normalize/gold-identity.s09.normalize.applicable.001.json"},"manifestRef":{"byteLength":4067,"contentHash":"e7fdb36c9841e21c97cd61e64219d82cf957eec1d091fbfce9fb501ab58d2ac4","fileSha256":"49ae18873a63a09c6683b913292df3177c9ca96cfef4727172df7c6cf07c0630","id":"FM-GATEB-NORMALIZE-PNG@0.9.0","path":"manifests/normalize-smoke.v0.9.0.json"},"operation":"normalize","runtimeRef":{"byteLength":29240,"contentHash":"be963d57e22744f760ec54cac7b83904ebe3878c4ec8e25b958aa1015ad8a3e5","fileSha256":"4ee8d8a1bf356412a4ca5bbd9e42f242d94c997b45f348dfc50314ddb697d446","id":"RUNTIME-SHARP-CANONICAL-PNG@0.9.0","path":"runtime/runtime-attestation.v0.9.0.json"},"schemaVersion":"gateb-case-context.slice09.v0","sourceId":"s09.normalize.applicable.001","sourceRef":{"byteLength":1336,"contentHash":"19732ceff2018125d45a4d3a47a7835fe9b6bb1ed2e754535b164eb471458481","fileSha256":"d1ace3ed8da37bafb4961d64ab041904a8ba8fdc19f3f8001ae4b8e1b895e73b","id":"s09.normalize.applicable.001","path":"source-lineage/normalize/s09.normalize.applicable.001.json"},"workerRef":{"id":"WORKER-SHARP-RAW@0.9.0","implementationSha256":"4ce6b725d509e35328c6826f1a7345c34b2582d2df19a9cb4b6115b8990f30bd"},"workerRequestRef":{"byteLength":1336,"contentHash":"19732ceff2018125d45a4d3a47a7835fe9b6bb1ed2e754535b164eb471458481","fileSha256":"d1ace3ed8da37bafb4961d64ab041904a8ba8fdc19f3f8001ae4b8e1b895e73b","id":"s09.normalize.applicable.001","path":"source-lineage/normalize/s09.normalize.applicable.001.json"}},"contentHash":"ad4ad05328465d3c00b769748bf40fd11a89a4cfb274ded5f71e6fa6c38cdecb","evidenceBoundary":{"C1":0,"E1":0,"G1":0,"O1":0,"R1":0,"U1":0,"V1":0,"formal":false,"productSupport":false,"releaseAllowlist":"none","releaseApproved":0,"releaseRegistered":0},"requestId":"request.s09.normalize.s09.normalize.applicable.001.r1","schemaVersion":"local-run-request.slice09.v0"}
