{"caseContext":{"attempt":{"attemptId":"s09.export.s09.export.rejection.006.r3","idempotencyKey":"3284c87dc8fc1a86cd2d76d7bb31fe64d0f1f36e2e8dfff6db19c78f356254dd","repetition":3},"candidateRef":{"byteLength":2467,"contentHash":"3e473dff9434d25d7d97bb577543ca18d6e771988d6b4184c776a179fa16885c","fileSha256":"301237afdc9589a6862427e40977f96ea954009c3ffb3a0fd00e47b12d86cd82","id":"REG-NORM-SHARP-CANONICAL-PNG@0.9.0","path":"candidate-locks/composite-canonical-png.v0.9.0.json"},"contentHash":"9620cbc581ba3a52c596ba55d1bd0f984da6155a60da18d89b98cc248a8fee30","contextId":"context.s09.export.s09.export.rejection.006.r3","contractRef":{"byteLength":884,"contentHash":"4bfd1de8baa2d312f68e208a1dc982b45e05c6ee252dbdfbc76085765544794e","fileSha256":"71dc2ac0d6362a8a6415093d8c15b28296c04e0cfa6bfe1f6322685f136f974d","id":"CC-CAP02-EXPORT-PNG@0.9.0","path":"contracts/cc-cap02-export-png.v0.9.0.json"},"disposition":"rejection","expectedStableErrorCode":"S09_EXPORT_NORMALIZED_ARTIFACT_INVALID","goldIdentityRef":null,"manifestRef":{"byteLength":3985,"contentHash":"298183aa987ea87d9b0abbb19e1fbcf8f21dae8d11b2f2af86bb296f813c6e48","fileSha256":"0eb829b8fe62fa28f345d7412bc11b1a0caf7042d77fd2f7db4e1e691cc22279","id":"FM-GATEB-EXPORT-PNG@0.9.0","path":"manifests/export-smoke.v0.9.0.json"},"operation":"export","runtimeRef":{"byteLength":29240,"contentHash":"be963d57e22744f760ec54cac7b83904ebe3878c4ec8e25b958aa1015ad8a3e5","fileSha256":"4ee8d8a1bf356412a4ca5bbd9e42f242d94c997b45f348dfc50314ddb697d446","id":"RUNTIME-SHARP-CANONICAL-PNG@0.9.0","path":"runtime/runtime-attestation.v0.9.0.json"},"schemaVersion":"gateb-case-context.slice09.v0","sourceId":"s09.export.rejection.006","sourceRef":{"byteLength":1330,"contentHash":"d00b62466a95917f774b38090d80c50babb97f1a7a1ead4279e827320dfeed39","fileSha256":"2820e806343dae7585ad3e417628b4b515ce9d192bd1a75517c8753fc11f6f10","id":"s09.export.rejection.006","path":"source-lineage/export/s09.export.rejection.006.json"},"workerRef":{"id":"WORKER-SHARP-RAW@0.9.0","implementationSha256":"4ce6b725d509e35328c6826f1a7345c34b2582d2df19a9cb4b6115b8990f30bd"},"workerRequestRef":{"byteLength":1330,"contentHash":"d00b62466a95917f774b38090d80c50babb97f1a7a1ead4279e827320dfeed39","fileSha256":"2820e806343dae7585ad3e417628b4b515ce9d192bd1a75517c8753fc11f6f10","id":"s09.export.rejection.006","path":"source-lineage/export/s09.export.rejection.006.json"}},"contentHash":"a24cf9f88dbfcd039456476cf7e2abe8dce4ea66735ffd53dba69d2d11c8ded8","evidenceBoundary":{"C1":0,"E1":0,"G1":0,"O1":0,"R1":0,"U1":0,"V1":0,"formal":false,"productSupport":false,"releaseAllowlist":"none","releaseApproved":0,"releaseRegistered":0},"requestId":"request.s09.export.s09.export.rejection.006.r3","schemaVersion":"local-run-request.slice09.v0"}
