{"caseContext":{"attempt":{"attemptId":"s09.export.s09.export.applicable.003.r1","idempotencyKey":"2704a44d34297be5517a847b87109bfe12d05a430c8aac8291dfd41ed49d3def","repetition":1},"candidateRef":{"byteLength":2467,"contentHash":"3e473dff9434d25d7d97bb577543ca18d6e771988d6b4184c776a179fa16885c","fileSha256":"301237afdc9589a6862427e40977f96ea954009c3ffb3a0fd00e47b12d86cd82","id":"REG-NORM-SHARP-CANONICAL-PNG@0.9.0","path":"candidate-locks/composite-canonical-png.v0.9.0.json"},"contentHash":"289876b8731a264a2beab16112ed4e5543dfafac97d09da79f8403ae2e2da43e","contextId":"context.s09.export.s09.export.applicable.003.r1","contractRef":{"byteLength":884,"contentHash":"4bfd1de8baa2d312f68e208a1dc982b45e05c6ee252dbdfbc76085765544794e","fileSha256":"71dc2ac0d6362a8a6415093d8c15b28296c04e0cfa6bfe1f6322685f136f974d","id":"CC-CAP02-EXPORT-PNG@0.9.0","path":"contracts/cc-cap02-export-png.v0.9.0.json"},"disposition":"applicable","expectedStableErrorCode":null,"goldIdentityRef":{"byteLength":1705,"contentHash":"2c09a4a92a2fbda24c565fa8c240c2f73d2ca347c8f9d62d3cf0b3858e8537a5","fileSha256":"a07743a6a7a9d339602281672d82fb187b9778977502161edad07e4d41660414","id":"gold-identity.s09.export.applicable.003","path":"gold-identities/export/gold-identity.s09.export.applicable.003.json"},"manifestRef":{"byteLength":3985,"contentHash":"298183aa987ea87d9b0abbb19e1fbcf8f21dae8d11b2f2af86bb296f813c6e48","fileSha256":"0eb829b8fe62fa28f345d7412bc11b1a0caf7042d77fd2f7db4e1e691cc22279","id":"FM-GATEB-EXPORT-PNG@0.9.0","path":"manifests/export-smoke.v0.9.0.json"},"operation":"export","runtimeRef":{"byteLength":29240,"contentHash":"be963d57e22744f760ec54cac7b83904ebe3878c4ec8e25b958aa1015ad8a3e5","fileSha256":"4ee8d8a1bf356412a4ca5bbd9e42f242d94c997b45f348dfc50314ddb697d446","id":"RUNTIME-SHARP-CANONICAL-PNG@0.9.0","path":"runtime/runtime-attestation.v0.9.0.json"},"schemaVersion":"gateb-case-context.slice09.v0","sourceId":"s09.export.applicable.003","sourceRef":{"byteLength":1390,"contentHash":"cbc0f1494297aaa0f346e41d73425a8ae918ecd12bcaae2be3dae3305f50de4c","fileSha256":"13716f484f8229a76acfba4ee4aae3bc4ff9e1c009f03248c501b0a7b5485f19","id":"s09.export.applicable.003","path":"source-lineage/export/s09.export.applicable.003.json"},"workerRef":{"id":"WORKER-SHARP-RAW@0.9.0","implementationSha256":"4ce6b725d509e35328c6826f1a7345c34b2582d2df19a9cb4b6115b8990f30bd"},"workerRequestRef":{"byteLength":1390,"contentHash":"cbc0f1494297aaa0f346e41d73425a8ae918ecd12bcaae2be3dae3305f50de4c","fileSha256":"13716f484f8229a76acfba4ee4aae3bc4ff9e1c009f03248c501b0a7b5485f19","id":"s09.export.applicable.003","path":"source-lineage/export/s09.export.applicable.003.json"}},"contentHash":"b2efd09b9d75f32807d3b57b6c0b6fd55aa932262e4dea377b44ced97a8835a4","evidenceBoundary":{"C1":0,"E1":0,"G1":0,"O1":0,"R1":0,"U1":0,"V1":0,"formal":false,"productSupport":false,"releaseAllowlist":"none","releaseApproved":0,"releaseRegistered":0},"requestId":"request.s09.export.s09.export.applicable.003.r1","schemaVersion":"local-run-request.slice09.v0"}
